Frame 1: 62 bytes on wire (496 bits), 62 bytes captured (496 bits)
    WTAP_ENCAP: 1
    Arrival Time: May 13, 2004 06:17:08.222534000 EDT
    [Time shift for this packet: 0.000000000 seconds]
    Epoch Time: 1084443428.222534000 seconds
    [Time delta from previous captured frame: 0.000000000 seconds]
    [Time delta from previous displayed frame: 0.000000000 seconds]
    [Time since reference or first frame: 0.000000000 seconds]
    Frame Number: 1
    Frame Length: 62 bytes (496 bits)
    Capture Length: 62 bytes (496 bits)
    [Frame is marked: False]
    [Frame is ignored: False]
    [Protocols in frame: eth:ip:tcp]
Ethernet II, Src: fe:ff:20:00:01:00 (fe:ff:20:00:01:00), Dst: Xerox_00:00:00 (00:00:01:00:00:00)
    Destination: Xerox_00:00:00 (00:00:01:00:00:00)
        Address: Xerox_00:00:00 (00:00:01:00:00:00)
        .... ..0. .... .... .... .... = LG bit: Globally unique address (factory default)
        .... ...0 .... .... .... .... = IG bit: Individual address (unicast)
    Source: fe:ff:20:00:01:00 (fe:ff:20:00:01:00)
        Address: fe:ff:20:00:01:00 (fe:ff:20:00:01:00)
        .... ..1. .... .... .... .... = LG bit: Locally administered address (this is NOT the factory default)
        .... ...0 .... .... .... .... = IG bit: Individual address (unicast)
    Type: IP (0x0800)
Internet Protocol Version 4, Src: 65.208.228.223 (65.208.228.223), Dst: 145.254.160.237 (145.254.160.237)
    Version: 4
    Header length: 20 bytes
    Differentiated Services Field: 0x00 (DSCP 0x00: Default; ECN: 0x00: Not-ECT (Not ECN-Capable Transport))
        0000 00.. = Differentiated Services Codepoint: Default (0x00)
        .... ..00 = Explicit Congestion Notification: Not-ECT (Not ECN-Capable Transport) (0x00)
    Total Length: 48
    Identification: 0x0000 (0)
    Flags: 0x02 (Don't Fragment)
        0... .... = Reserved bit: Not set
        .1.. .... = Don't fragment: Set
        ..0. .... = More fragments: Not set
    Fragment offset: 0
    Time to live: 47
    Protocol: TCP (6)
    Header checksum: 0xf22c [correct]
        [Good: True]
        [Bad: False]
    Source: 65.208.228.223 (65.208.228.223)
    Destination: 145.254.160.237 (145.254.160.237)
    [Source GeoIP: Unknown]
    [Destination GeoIP: Unknown]
Transmission Control Protocol, Src Port: http (80), Dst Port: tip2 (3372), Seq: 290218379, Ack: 951057940, Len: 0
    Source port: http (80)
    Destination port: tip2 (3372)
    [Stream index: 0]
    Sequence number: 290218379
    Acknowledgment number: 951057940
    Header length: 28 bytes
    Flags: 0x012 (SYN, ACK)
        000. .... .... = Reserved: Not set
        ...0 .... .... = Nonce: Not set
        .... 0... .... = Congestion Window Reduced (CWR): Not set
        .... .0.. .... = ECN-Echo: Not set
        .... ..0. .... = Urgent: Not set
        .... ...1 .... = Acknowledgment: Set
        .... .... 0... = Push: Not set
        .... .... .0.. = Reset: Not set
        .... .... ..1. = Syn: Set
            [Expert Info (Chat/Sequence): Connection establish acknowledge (SYN+ACK): server port http]
                [Message: Connection establish acknowledge (SYN+ACK): server port http]
                [Severity level: Chat]
                [Group: Sequence]
        .... .... ...0 = Fin: Not set
    Window size value: 5840
    [Calculated window size: 5840]
    Checksum: 0x5bdc [validation disabled]
        [Good Checksum: False]
        [Bad Checksum: False]
    Options: (8 bytes), Maximum segment size, No-Operation (NOP), No-Operation (NOP), SACK permitted
        Maximum segment size: 1380 bytes
            Kind: MSS size (2)
            Length: 4
            MSS Value: 1380
        No-Operation (NOP)
            Type: 1
                0... .... = Copy on fragmentation: No
                .00. .... = Class: Control (0)
                ...0 0001 = Number: No-Operation (NOP) (1)
        No-Operation (NOP)
            Type: 1
                0... .... = Copy on fragmentation: No
                .00. .... = Class: Control (0)
                ...0 0001 = Number: No-Operation (NOP) (1)
        TCP SACK Permitted Option: True
            Kind: SACK Permission (4)
            Length: 2

0000  00 00 01 00 00 00 fe ff 20 00 01 00 08 00 45 00   ........ .....E.
0010  00 30 00 00 40 00 2f 06 f2 2c 41 d0 e4 df 91 fe   .0..@./..,A.....
0020  a0 ed 00 50 0d 2c 11 4c 61 8b 38 af fe 14 70 12   ...P.,.La.8...p.
0030  16 d0 5b dc 00 00 02 04 05 64 01 01 04 02         ..[......d....

Frame 1: 54 bytes on wire (432 bits), 54 bytes captured (432 bits)
    WTAP_ENCAP: 1
    Arrival Time: May 13, 2004 06:17:08.222534000 EDT
    [Time shift for this packet: 0.000000000 seconds]
    Epoch Time: 1084443428.222534000 seconds
    [Time delta from previous captured frame: 0.000000000 seconds]
    [Time delta from previous displayed frame: 0.000000000 seconds]
    [Time since reference or first frame: 0.000000000 seconds]
    Frame Number: 1
    Frame Length: 54 bytes (432 bits)
    Capture Length: 54 bytes (432 bits)
    [Frame is marked: False]
    [Frame is ignored: False]
    [Protocols in frame: eth:ip:tcp]
Ethernet II, Src: Xerox_00:00:00 (00:00:01:00:00:00), Dst: fe:ff:20:00:01:00 (fe:ff:20:00:01:00)
    Destination: fe:ff:20:00:01:00 (fe:ff:20:00:01:00)
        Address: fe:ff:20:00:01:00 (fe:ff:20:00:01:00)
        .... ..1. .... .... .... .... = LG bit: Locally administered address (this is NOT the factory default)
        .... ...0 .... .... .... .... = IG bit: Individual address (unicast)
    Source: Xerox_00:00:00 (00:00:01:00:00:00)
        Address: Xerox_00:00:00 (00:00:01:00:00:00)
        .... ..0. .... .... .... .... = LG bit: Globally unique address (factory default)
        .... ...0 .... .... .... .... = IG bit: Individual address (unicast)
    Type: IP (0x0800)
Internet Protocol Version 4, Src: 145.254.160.237 (145.254.160.237), Dst: 65.208.228.223 (65.208.228.223)
    Version: 4
    Header length: 20 bytes
    Differentiated Services Field: 0x00 (DSCP 0x00: Default; ECN: 0x00: Not-ECT (Not ECN-Capable Transport))
        0000 00.. = Differentiated Services Codepoint: Default (0x00)
        .... ..00 = Explicit Congestion Notification: Not-ECT (Not ECN-Capable Transport) (0x00)
    Total Length: 40
    Identification: 0x0f44 (3908)
    Flags: 0x02 (Don't Fragment)
        0... .... = Reserved bit: Not set
        .1.. .... = Don't fragment: Set
        ..0. .... = More fragments: Not set
    Fragment offset: 0
    Time to live: 128
    Protocol: TCP (6)
    Header checksum: 0x91f0 [correct]
        [Good: True]
        [Bad: False]
    Source: 145.254.160.237 (145.254.160.237)
    Destination: 65.208.228.223 (65.208.228.223)
    [Source GeoIP: Unknown]
    [Destination GeoIP: Unknown]
Transmission Control Protocol, Src Port: tip2 (3372), Dst Port: http (80), Seq: 951057940, Ack: 290218380, Len: 0
    Source port: tip2 (3372)
    Destination port: http (80)
    [Stream index: 0]
    Sequence number: 951057940
    Acknowledgment number: 290218380
    Header length: 20 bytes
    Flags: 0x010 (ACK)
        000. .... .... = Reserved: Not set
        ...0 .... .... = Nonce: Not set
        .... 0... .... = Congestion Window Reduced (CWR): Not set
        .... .0.. .... = ECN-Echo: Not set
        .... ..0. .... = Urgent: Not set
        .... ...1 .... = Acknowledgment: Set
        .... .... 0... = Push: Not set
        .... .... .0.. = Reset: Not set
        .... .... ..0. = Syn: Not set
        .... .... ...0 = Fin: Not set
    Window size value: 9660
    [Calculated window size: 9660]
    [Window size scaling factor: -1 (unknown)]
    Checksum: 0x7964 [validation disabled]
        [Good Checksum: False]
        [Bad Checksum: False]

0000  fe ff 20 00 01 00 00 00 01 00 00 00 08 00 45 00   .. ...........E.
0010  00 28 0f 44 40 00 80 06 91 f0 91 fe a0 ed 41 d0   .(.D@.........A.
0020  e4 df 0d 2c 00 50 38 af fe 14 11 4c 61 8c 50 10   ...,.P8....La.P.
0030  25 bc 79 64 00 00                                 %.yd..

Frame 1: 62 bytes on wire (496 bits), 62 bytes captured (496 bits)
    WTAP_ENCAP: 1
    Arrival Time: May 13, 2004 06:17:07.311224000 EDT
    [Time shift for this packet: 0.000000000 seconds]
    Epoch Time: 1084443427.311224000 seconds
    [Time delta from previous captured frame: 0.000000000 seconds]
    [Time delta from previous displayed frame: 0.000000000 seconds]
    [Time since reference or first frame: 0.000000000 seconds]
    Frame Number: 1
    Frame Length: 62 bytes (496 bits)
    Capture Length: 62 bytes (496 bits)
    [Frame is marked: False]
    [Frame is ignored: False]
    [Protocols in frame: eth:ip:tcp]
Ethernet II, Src: Xerox_00:00:00 (00:00:01:00:00:00), Dst: fe:ff:20:00:01:00 (fe:ff:20:00:01:00)
    Destination: fe:ff:20:00:01:00 (fe:ff:20:00:01:00)
        Address: fe:ff:20:00:01:00 (fe:ff:20:00:01:00)
        .... ..1. .... .... .... .... = LG bit: Locally administered address (this is NOT the factory default)
        .... ...0 .... .... .... .... = IG bit: Individual address (unicast)
    Source: Xerox_00:00:00 (00:00:01:00:00:00)
        Address: Xerox_00:00:00 (00:00:01:00:00:00)
        .... ..0. .... .... .... .... = LG bit: Globally unique address (factory default)
        .... ...0 .... .... .... .... = IG bit: Individual address (unicast)
    Type: IP (0x0800)
Internet Protocol Version 4, Src: 145.254.160.237 (145.254.160.237), Dst: 65.208.228.223 (65.208.228.223)
    Version: 4
    Header length: 20 bytes
    Differentiated Services Field: 0x00 (DSCP 0x00: Default; ECN: 0x00: Not-ECT (Not ECN-Capable Transport))
        0000 00.. = Differentiated Services Codepoint: Default (0x00)
        .... ..00 = Explicit Congestion Notification: Not-ECT (Not ECN-Capable Transport) (0x00)
    Total Length: 48
    Identification: 0x0f41 (3905)
    Flags: 0x02 (Don't Fragment)
        0... .... = Reserved bit: Not set
        .1.. .... = Don't fragment: Set
        ..0. .... = More fragments: Not set
    Fragment offset: 0
    Time to live: 128
    Protocol: TCP (6)
    Header checksum: 0x91eb [correct]
        [Good: True]
        [Bad: False]
    Source: 145.254.160.237 (145.254.160.237)
    Destination: 65.208.228.223 (65.208.228.223)
    [Source GeoIP: Unknown]
    [Destination GeoIP: Unknown]
Transmission Control Protocol, Src Port: tip2 (3372), Dst Port: http (80), Seq: 951057939, Len: 0
    Source port: tip2 (3372)
    Destination port: http (80)
    [Stream index: 0]
    Sequence number: 951057939
    Header length: 28 bytes
    Flags: 0x002 (SYN)
        000. .... .... = Reserved: Not set
        ...0 .... .... = Nonce: Not set
        .... 0... .... = Congestion Window Reduced (CWR): Not set
        .... .0.. .... = ECN-Echo: Not set
        .... ..0. .... = Urgent: Not set
        .... ...0 .... = Acknowledgment: Not set
        .... .... 0... = Push: Not set
        .... .... .0.. = Reset: Not set
        .... .... ..1. = Syn: Set
            [Expert Info (Chat/Sequence): Connection establish request (SYN): server port http]
                [Message: Connection establish request (SYN): server port http]
                [Severity level: Chat]
                [Group: Sequence]
        .... .... ...0 = Fin: Not set
    Window size value: 8760
    [Calculated window size: 8760]
    Checksum: 0xc30c [validation disabled]
        [Good Checksum: False]
        [Bad Checksum: False]
    Options: (8 bytes), Maximum segment size, No-Operation (NOP), No-Operation (NOP), SACK permitted
        Maximum segment size: 1460 bytes
            Kind: MSS size (2)
            Length: 4
            MSS Value: 1460
        No-Operation (NOP)
            Type: 1
                0... .... = Copy on fragmentation: No
                .00. .... = Class: Control (0)
                ...0 0001 = Number: No-Operation (NOP) (1)
        No-Operation (NOP)
            Type: 1
                0... .... = Copy on fragmentation: No
                .00. .... = Class: Control (0)
                ...0 0001 = Number: No-Operation (NOP) (1)
        TCP SACK Permitted Option: True
            Kind: SACK Permission (4)
            Length: 2

0000  fe ff 20 00 01 00 00 00 01 00 00 00 08 00 45 00   .. ...........E.
0010  00 30 0f 41 40 00 80 06 91 eb 91 fe a0 ed 41 d0   .0.A@.........A.
0020  e4 df 0d 2c 00 50 38 af fe 13 00 00 00 00 70 02   ...,.P8.......p.
0030  22 38 c3 0c 00 00 02 04 05 b4 01 01 04 02         "8............

Frame 1: 54 bytes on wire (432 bits), 54 bytes captured (432 bits)
    WTAP_ENCAP: 1
    Arrival Time: May 13, 2004 06:17:08.783340000 EDT
    [Time shift for this packet: 0.000000000 seconds]
    Epoch Time: 1084443428.783340000 seconds
    [Time delta from previous captured frame: 0.000000000 seconds]
    [Time delta from previous displayed frame: 0.000000000 seconds]
    [Time since reference or first frame: 0.000000000 seconds]
    Frame Number: 1
    Frame Length: 54 bytes (432 bits)
    Capture Length: 54 bytes (432 bits)
    [Frame is marked: False]
    [Frame is ignored: False]
    [Protocols in frame: eth:ip:tcp]
Ethernet II, Src: fe:ff:20:00:01:00 (fe:ff:20:00:01:00), Dst: Xerox_00:00:00 (00:00:01:00:00:00)
    Destination: Xerox_00:00:00 (00:00:01:00:00:00)
        Address: Xerox_00:00:00 (00:00:01:00:00:00)
        .... ..0. .... .... .... .... = LG bit: Globally unique address (factory default)
        .... ...0 .... .... .... .... = IG bit: Individual address (unicast)
    Source: fe:ff:20:00:01:00 (fe:ff:20:00:01:00)
        Address: fe:ff:20:00:01:00 (fe:ff:20:00:01:00)
        .... ..1. .... .... .... .... = LG bit: Locally administered address (this is NOT the factory default)
        .... ...0 .... .... .... .... = IG bit: Individual address (unicast)
    Type: IP (0x0800)
Internet Protocol Version 4, Src: 65.208.228.223 (65.208.228.223), Dst: 145.254.160.237 (145.254.160.237)
    Version: 4
    Header length: 20 bytes
    Differentiated Services Field: 0x00 (DSCP 0x00: Default; ECN: 0x00: Not-ECT (Not ECN-Capable Transport))
        0000 00.. = Differentiated Services Codepoint: Default (0x00)
        .... ..00 = Explicit Congestion Notification: Not-ECT (Not ECN-Capable Transport) (0x00)
    Total Length: 40
    Identification: 0xc09e (49310)
    Flags: 0x02 (Don't Fragment)
        0... .... = Reserved bit: Not set
        .1.. .... = Don't fragment: Set
        ..0. .... = More fragments: Not set
    Fragment offset: 0
    Time to live: 47
    Protocol: TCP (6)
    Header checksum: 0x3196 [correct]
        [Good: True]
        [Bad: False]
    Source: 65.208.228.223 (65.208.228.223)
    Destination: 145.254.160.237 (145.254.160.237)
    [Source GeoIP: Unknown]
    [Destination GeoIP: Unknown]
Transmission Control Protocol, Src Port: http (80), Dst Port: tip2 (3372), Seq: 290218380, Ack: 951058419, Len: 0
    Source port: http (80)
    Destination port: tip2 (3372)
    [Stream index: 0]
    Sequence number: 290218380
    Acknowledgment number: 951058419
    Header length: 20 bytes
    Flags: 0x010 (ACK)
        000. .... .... = Reserved: Not set
        ...0 .... .... = Nonce: Not set
        .... 0... .... = Congestion Window Reduced (CWR): Not set
        .... .0.. .... = ECN-Echo: Not set
        .... ..0. .... = Urgent: Not set
        .... ...1 .... = Acknowledgment: Set
        .... .... 0... = Push: Not set
        .... .... .0.. = Reset: Not set
        .... .... ..0. = Syn: Not set
        .... .... ...0 = Fin: Not set
    Window size value: 6432
    [Calculated window size: 6432]
    [Window size scaling factor: -1 (unknown)]
    Checksum: 0x8421 [validation disabled]
        [Good Checksum: False]
        [Bad Checksum: False]

0000  00 00 01 00 00 00 fe ff 20 00 01 00 08 00 45 00   ........ .....E.
0010  00 28 c0 9e 40 00 2f 06 31 96 41 d0 e4 df 91 fe   .(..@./.1.A.....
0020  a0 ed 00 50 0d 2c 11 4c 61 8c 38 af ff f3 50 10   ...P.,.La.8...P.
0030  19 20 84 21 00 00                                 . .!..

Frame 1: 1434 bytes on wire (11472 bits), 1434 bytes captured (11472 bits)
    WTAP_ENCAP: 1
    Arrival Time: May 13, 2004 06:17:08.993643000 EDT
    [Time shift for this packet: 0.000000000 seconds]
    Epoch Time: 1084443428.993643000 seconds
    [Time delta from previous captured frame: 0.000000000 seconds]
    [Time delta from previous displayed frame: 0.000000000 seconds]
    [Time since reference or first frame: 0.000000000 seconds]
    Frame Number: 1
    Frame Length: 1434 bytes (11472 bits)
    Capture Length: 1434 bytes (11472 bits)
    [Frame is marked: False]
    [Frame is ignored: False]
    [Protocols in frame: eth:ip:tcp:http]
Ethernet II, Src: fe:ff:20:00:01:00 (fe:ff:20:00:01:00), Dst: Xerox_00:00:00 (00:00:01:00:00:00)
    Destination: Xerox_00:00:00 (00:00:01:00:00:00)
        Address: Xerox_00:00:00 (00:00:01:00:00:00)
        .... ..0. .... .... .... .... = LG bit: Globally unique address (factory default)
        .... ...0 .... .... .... .... = IG bit: Individual address (unicast)
    Source: fe:ff:20:00:01:00 (fe:ff:20:00:01:00)
        Address: fe:ff:20:00:01:00 (fe:ff:20:00:01:00)
        .... ..1. .... .... .... .... = LG bit: Locally administered address (this is NOT the factory default)
        .... ...0 .... .... .... .... = IG bit: Individual address (unicast)
    Type: IP (0x0800)
Internet Protocol Version 4, Src: 65.208.228.223 (65.208.228.223), Dst: 145.254.160.237 (145.254.160.237)
    Version: 4
    Header length: 20 bytes
    Differentiated Services Field: 0x00 (DSCP 0x00: Default; ECN: 0x00: Not-ECT (Not ECN-Capable Transport))
        0000 00.. = Differentiated Services Codepoint: Default (0x00)
        .... ..00 = Explicit Congestion Notification: Not-ECT (Not ECN-Capable Transport) (0x00)
    Total Length: 1420
    Identification: 0xc09f (49311)
    Flags: 0x02 (Don't Fragment)
        0... .... = Reserved bit: Not set
        .1.. .... = Don't fragment: Set
        ..0. .... = More fragments: Not set
    Fragment offset: 0
    Time to live: 47
    Protocol: TCP (6)
    Header checksum: 0x2c31 [correct]
        [Good: True]
        [Bad: False]
    Source: 65.208.228.223 (65.208.228.223)
    Destination: 145.254.160.237 (145.254.160.237)
    [Source GeoIP: Unknown]
    [Destination GeoIP: Unknown]
Transmission Control Protocol, Src Port: http (80), Dst Port: tip2 (3372), Seq: 290218380, Ack: 951058419, Len: 1380
    Source port: http (80)
    Destination port: tip2 (3372)
    [Stream index: 0]
    Sequence number: 290218380
    [Next sequence number: 290219760]
    Acknowledgment number: 951058419
    Header length: 20 bytes
    Flags: 0x010 (ACK)
        000. .... .... = Reserved: Not set
        ...0 .... .... = Nonce: Not set
        .... 0... .... = Congestion Window Reduced (CWR): Not set
        .... .0.. .... = ECN-Echo: Not set
        .... ..0. .... = Urgent: Not set
        .... ...1 .... = Acknowledgment: Set
        .... .... 0... = Push: Not set
        .... .... .0.. = Reset: Not set
        .... .... ..0. = Syn: Not set
        .... .... ...0 = Fin: Not set
    Window size value: 6432
    [Calculated window size: 6432]
    [Window size scaling factor: -1 (unknown)]
    Checksum: 0x2b0a [validation disabled]
        [Good Checksum: False]
        [Bad Checksum: False]
    [SEQ/ACK analysis]
        [Bytes in flight: 1380]
    TCP segment data (1380 bytes)

0000  00 00 01 00 00 00 fe ff 20 00 01 00 08 00 45 00   ........ .....E.
0010  05 8c c0 9f 40 00 2f 06 2c 31 41 d0 e4 df 91 fe   ....@./.,1A.....
0020  a0 ed 00 50 0d 2c 11 4c 61 8c 38 af ff f3 50 10   ...P.,.La.8...P.
0030  19 20 2b 0a 00 00 48 54 54 50 2f 31 2e 31 20 32   . +...HTTP/1.1 2
0040  30 30 20 4f 4b 0d 0a 44 61 74 65 3a 20 54 68 75   00 OK..Date: Thu
0050  2c 20 31 33 20 4d 61 79 20 32 30 30 34 20 31 30   , 13 May 2004 10
0060  3a 31 37 3a 31 32 20 47 4d 54 0d 0a 53 65 72 76   :17:12 GMT..Serv
0070  65 72 3a 20 41 70 61 63 68 65 0d 0a 4c 61 73 74   er: Apache..Last
0080  2d 4d 6f 64 69 66 69 65 64 3a 20 54 75 65 2c 20   -Modified: Tue, 
0090  32 30 20 41 70 72 20 32 30 30 34 20 31 33 3a 31   20 Apr 2004 13:1
00a0  37 3a 30 30 20 47 4d 54 0d 0a 45 54 61 67 3a 20   7:00 GMT..ETag: 
00b0  22 39 61 30 31 61 2d 34 36 39 36 2d 37 65 33 35   "9a01a-4696-7e35
00c0  34 62 30 30 22 0d 0a 41 63 63 65 70 74 2d 52 61   4b00"..Accept-Ra
00d0  6e 67 65 73 3a 20 62 79 74 65 73 0d 0a 43 6f 6e   nges: bytes..Con
00e0  74 65 6e 74 2d 4c 65 6e 67 74 68 3a 20 31 38 30   tent-Length: 180
00f0  37 30 0d 0a 4b 65 65 70 2d 41 6c 69 76 65 3a 20   70..Keep-Alive: 
0100  74 69 6d 65 6f 75 74 3d 31 35 2c 20 6d 61 78 3d   timeout=15, max=
0110  31 30 30 0d 0a 43 6f 6e 6e 65 63 74 69 6f 6e 3a   100..Connection:
0120  20 4b 65 65 70 2d 41 6c 69 76 65 0d 0a 43 6f 6e    Keep-Alive..Con
0130  74 65 6e 74 2d 54 79 70 65 3a 20 74 65 78 74 2f   tent-Type: text/
0140  68 74 6d 6c 3b 20 63 68 61 72 73 65 74 3d 49 53   html; charset=IS
0150  4f 2d 38 38 35 39 2d 31 0d 0a 0d 0a 3c 3f 78 6d   O-8859-1....<?xm
0160  6c 20 76 65 72 73 69 6f 6e 3d 22 31 2e 30 22 20   l version="1.0" 
0170  65 6e 63 6f 64 69 6e 67 3d 22 55 54 46 2d 38 22   encoding="UTF-8"
0180  3f 3e 0a 3c 21 44 4f 43 54 59 50 45 20 68 74 6d   ?>.<!DOCTYPE htm
0190  6c 0a 20 20 50 55 42 4c 49 43 20 22 2d 2f 2f 57   l.  PUBLIC "-//W
01a0  33 43 2f 2f 44 54 44 20 58 48 54 4d 4c 20 31 2e   3C//DTD XHTML 1.
01b0  30 20 53 74 72 69 63 74 2f 2f 45 4e 22 0a 20 20   0 Strict//EN".  
01c0  22 44 54 44 2f 78 68 74 6d 6c 31 2d 73 74 72 69   "DTD/xhtml1-stri
01d0  63 74 2e 64 74 64 22 3e 0a 3c 68 74 6d 6c 20 78   ct.dtd">.<html x
01e0  6d 6c 6e 73 3d 22 68 74 74 70 3a 2f 2f 77 77 77   mlns="http://www
01f0  2e 77 33 2e 6f 72 67 2f 31 39 39 39 2f 78 68 74   .w3.org/1999/xht
0200  6d 6c 22 20 78 6d 6c 3a 6c 61 6e 67 3d 22 65 6e   ml" xml:lang="en
0210  22 20 6c 61 6e 67 3d 22 65 6e 22 3e 0a 20 20 3c   " lang="en">.  <
0220  68 65 61 64 3e 0a 20 20 20 20 3c 74 69 74 6c 65   head>.    <title
0230  3e 45 74 68 65 72 65 61 6c 3a 20 44 6f 77 6e 6c   >Ethereal: Downl
0240  6f 61 64 3c 2f 74 69 74 6c 65 3e 0a 20 20 20 20   oad</title>.    
0250  3c 73 74 79 6c 65 20 74 79 70 65 3d 22 74 65 78   <style type="tex
0260  74 2f 63 73 73 22 20 6d 65 64 69 61 3d 22 61 6c   t/css" media="al
0270  6c 22 3e 0a 09 40 69 6d 70 6f 72 74 20 75 72 6c   l">..@import url
0280  28 22 6d 6d 2f 63 73 73 2f 65 74 68 65 72 65 61   ("mm/css/etherea
0290  6c 2d 33 2d 30 2e 63 73 73 22 29 3b 0a 20 20 20   l-3-0.css");.   
02a0  20 3c 2f 73 74 79 6c 65 3e 0a 3c 2f 68 65 61 64    </style>.</head
02b0  3e 0a 20 20 3c 62 6f 64 79 3e 0a 20 20 20 20 3c   >.  <body>.    <
02c0  64 69 76 20 63 6c 61 73 73 3d 22 74 6f 70 22 3e   div class="top">
02d0  0a 20 20 20 20 3c 74 61 62 6c 65 20 77 69 64 74   .    <table widt
02e0  68 3d 22 31 30 30 25 22 20 63 65 6c 6c 73 70 61   h="100%" cellspa
02f0  63 69 6e 67 3d 22 30 22 20 63 65 6c 6c 70 61 64   cing="0" cellpad
0300  64 69 6e 67 3d 22 30 22 20 62 6f 72 64 65 72 3d   ding="0" border=
0310  22 30 22 20 73 75 6d 6d 61 72 79 3d 22 22 3e 0a   "0" summary="">.
0320  20 20 20 20 20 20 3c 74 72 3e 0a 20 20 20 20 20         <tr>.     
0330  20 20 20 3c 74 64 20 76 61 6c 69 67 6e 3d 22 6d      <td valign="m
0340  69 64 64 6c 65 22 20 77 69 64 74 68 3d 22 31 22   iddle" width="1"
0350  3e 0a 09 20 20 3c 61 20 68 72 65 66 3d 22 2f 22   >..  <a href="/"
0360  3e 3c 69 6d 67 20 63 6c 61 73 73 3d 22 6c 6f 67   ><img class="log
0370  6f 22 20 74 69 74 6c 65 3d 22 45 74 68 65 72 65   o" title="Ethere
0380  61 6c 20 68 6f 6d 65 22 20 73 72 63 3d 22 6d 6d   al home" src="mm
0390  2f 69 6d 61 67 65 2f 65 6c 6f 67 6f 2d 36 34 2d   /image/elogo-64-
03a0  74 72 61 6e 73 2e 67 69 66 22 20 61 6c 74 3d 22   trans.gif" alt="
03b0  22 20 77 69 64 74 68 3d 22 36 34 22 20 68 65 69   " width="64" hei
03c0  67 68 74 3d 22 36 34 22 3e 3c 2f 69 6d 67 3e 3c   ght="64"></img><
03d0  2f 61 3e 0a 20 20 20 20 20 20 20 20 3c 2f 74 64   /a>.        </td
03e0  3e 0a 20 20 20 20 20 20 20 20 3c 74 64 20 61 6c   >.        <td al
03f0  69 67 6e 3d 22 6c 65 66 74 22 20 76 61 6c 69 67   ign="left" valig
0400  6e 3d 22 6d 69 64 64 6c 65 22 3e 0a 20 20 20 20   n="middle">.    
0410  20 20 20 20 20 20 3c 68 32 3e 45 74 68 65 72 65         <h2>Ethere
0420  61 6c 3c 2f 68 32 3e 0a 20 20 20 20 20 20 20 20   al</h2>.        
0430  20 20 3c 68 35 20 73 74 79 6c 65 3d 22 77 68 69     <h5 style="whi
0440  74 65 2d 73 70 61 63 65 3a 20 6e 6f 77 72 61 70   te-space: nowrap
0450  3b 22 3e 44 6f 77 6e 6c 6f 61 64 3c 2f 68 35 3e   ;">Download</h5>
0460  0a 20 20 20 20 20 20 20 20 3c 2f 74 64 3e 0a 20   .        </td>. 
0470  20 20 20 20 20 20 20 3c 74 64 20 61 6c 69 67 6e          <td align
0480  3d 22 72 69 67 68 74 22 3e 0a 09 20 20 20 20 3c   ="right">..    <
0490  74 61 62 6c 65 20 73 74 79 6c 65 3d 22 6d 61 72   table style="mar
04a0  67 69 6e 2d 72 69 67 68 74 3a 20 31 30 70 78 3b   gin-right: 10px;
04b0  22 20 63 65 6c 6c 73 70 61 63 69 6e 67 3d 22 30   " cellspacing="0
04c0  22 20 63 65 6c 6c 70 61 64 64 69 6e 67 3d 22 30   " cellpadding="0
04d0  22 20 62 6f 72 64 65 72 3d 22 30 22 20 73 75 6d   " border="0" sum
04e0  6d 61 72 79 3d 22 22 3e 0a 20 20 20 20 20 20 20   mary="">.       
04f0  20 20 20 20 20 20 20 3c 66 6f 72 6d 20 6e 61 6d          <form nam
0500  65 3d 22 73 65 61 72 63 68 22 20 6d 65 74 68 6f   e="search" metho
0510  64 3d 22 70 6f 73 74 22 20 61 63 74 69 6f 6e 3d   d="post" action=
0520  22 68 74 74 70 3a 2f 2f 77 77 77 2e 65 74 68 65   "http://www.ethe
0530  72 65 61 6c 2e 63 6f 6d 2f 63 67 69 2d 62 69 6e   real.com/cgi-bin
0540  2f 68 74 73 65 61 72 63 68 22 3e 0a 20 20 20 20   /htsearch">.    
0550  20 20 20 20 20 20 20 20 20 20 3c 74 72 3e 0a 09             <tr>..
0560  20 20 20 20 20 20 20 20 3c 74 64 3e 0a 09 20 20           <td>..  
0570  20 20 20 20 20 20 20 20 3c 64 69 76 20 63 6c 61           <div cla
0580  73 73 3d 22 74 6f 70 66 6f 72 6d 74 65 78 74 22   ss="topformtext"
0590  3e 0a 20 20 20 20 20 20 20 20                     >.        

Frame 1: 1434 bytes on wire (11472 bits), 1434 bytes captured (11472 bits)
    WTAP_ENCAP: 1
    Arrival Time: May 13, 2004 06:17:09.123830000 EDT
    [Time shift for this packet: 0.000000000 seconds]
    Epoch Time: 1084443429.123830000 seconds
    [Time delta from previous captured frame: 0.000000000 seconds]
    [Time delta from previous displayed frame: 0.000000000 seconds]
    [Time since reference or first frame: 0.000000000 seconds]
    Frame Number: 1
    Frame Length: 1434 bytes (11472 bits)
    Capture Length: 1434 bytes (11472 bits)
    [Frame is marked: False]
    [Frame is ignored: False]
    [Protocols in frame: eth:ip:tcp:http:data]
Ethernet II, Src: fe:ff:20:00:01:00 (fe:ff:20:00:01:00), Dst: Xerox_00:00:00 (00:00:01:00:00:00)
    Destination: Xerox_00:00:00 (00:00:01:00:00:00)
        Address: Xerox_00:00:00 (00:00:01:00:00:00)
        .... ..0. .... .... .... .... = LG bit: Globally unique address (factory default)
        .... ...0 .... .... .... .... = IG bit: Individual address (unicast)
    Source: fe:ff:20:00:01:00 (fe:ff:20:00:01:00)
        Address: fe:ff:20:00:01:00 (fe:ff:20:00:01:00)
        .... ..1. .... .... .... .... = LG bit: Locally administered address (this is NOT the factory default)
        .... ...0 .... .... .... .... = IG bit: Individual address (unicast)
    Type: IP (0x0800)
Internet Protocol Version 4, Src: 65.208.228.223 (65.208.228.223), Dst: 145.254.160.237 (145.254.160.237)
    Version: 4
    Header length: 20 bytes
    Differentiated Services Field: 0x00 (DSCP 0x00: Default; ECN: 0x00: Not-ECT (Not ECN-Capable Transport))
        0000 00.. = Differentiated Services Codepoint: Default (0x00)
        .... ..00 = Explicit Congestion Notification: Not-ECT (Not ECN-Capable Transport) (0x00)
    Total Length: 1420
    Identification: 0xc0a0 (49312)
    Flags: 0x02 (Don't Fragment)
        0... .... = Reserved bit: Not set
        .1.. .... = Don't fragment: Set
        ..0. .... = More fragments: Not set
    Fragment offset: 0
    Time to live: 47
    Protocol: TCP (6)
    Header checksum: 0x2c30 [correct]
        [Good: True]
        [Bad: False]
    Source: 65.208.228.223 (65.208.228.223)
    Destination: 145.254.160.237 (145.254.160.237)
    [Source GeoIP: Unknown]
    [Destination GeoIP: Unknown]
Transmission Control Protocol, Src Port: http (80), Dst Port: tip2 (3372), Seq: 290219760, Ack: 951058419, Len: 1380
    Source port: http (80)
    Destination port: tip2 (3372)
    [Stream index: 0]
    Sequence number: 290219760
    [Next sequence number: 290221140]
    Acknowledgment number: 951058419
    Header length: 20 bytes
    Flags: 0x010 (ACK)
        000. .... .... = Reserved: Not set
        ...0 .... .... = Nonce: Not set
        .... 0... .... = Congestion Window Reduced (CWR): Not set
        .... .0.. .... = ECN-Echo: Not set
        .... ..0. .... = Urgent: Not set
        .... ...1 .... = Acknowledgment: Set
        .... .... 0... = Push: Not set
        .... .... .0.. = Reset: Not set
        .... .... ..0. = Syn: Not set
        .... .... ...0 = Fin: Not set
    Window size value: 6432
    [Calculated window size: 6432]
    [Window size scaling factor: -1 (unknown)]
    Checksum: 0xc351 [validation disabled]
        [Good Checksum: False]
        [Bad Checksum: False]
    [SEQ/ACK analysis]
        [Bytes in flight: 1380]
Hypertext Transfer Protocol
    Data (1380 bytes)
        Data: 202020202020202020203c6120687265663d227365617263...
        [Length: 1380]

0000  00 00 01 00 00 00 fe ff 20 00 01 00 08 00 45 00   ........ .....E.
0010  05 8c c0 a0 40 00 2f 06 2c 30 41 d0 e4 df 91 fe   ....@./.,0A.....
0020  a0 ed 00 50 0d 2c 11 4c 66 f0 38 af ff f3 50 10   ...P.,.Lf.8...P.
0030  19 20 c3 51 00 00 20 20 20 20 20 20 20 20 20 20   . .Q..          
0040  3c 61 20 68 72 65 66 3d 22 73 65 61 72 63 68 2e   <a href="search.
0050  68 74 6d 6c 22 3e 53 65 61 72 63 68 3a 3c 2f 61   html">Search:</a
0060  3e 0a 09 09 20 20 3c 2f 64 69 76 3e 0a 09 20 20   >...  </div>..  
0070  20 20 20 20 20 20 3c 2f 74 64 3e 0a 09 20 20 20         </td>..   
0080  20 20 20 20 20 3c 74 64 3e 0a 09 20 20 20 20 20        <td>..     
0090  20 20 20 20 20 3c 64 69 76 20 63 6c 61 73 73 3d        <div class=
00a0  22 74 6f 70 66 6f 72 6d 74 65 78 74 22 3e 0a 20   "topformtext">. 
00b0  20 20 20 20 20 20 20 20 20 20 20 20 20 20 20 20                   
00c0  20 3c 69 6e 70 75 74 20 74 79 70 65 3d 22 74 65    <input type="te
00d0  78 74 22 20 73 69 7a 65 3d 22 31 32 22 20 6e 61   xt" size="12" na
00e0  6d 65 3d 22 77 6f 72 64 73 22 3e 0a 09 09 20 20   me="words">...  
00f0  3c 69 6e 70 75 74 20 74 79 70 65 3d 22 68 69 64   <input type="hid
0100  64 65 6e 22 20 6e 61 6d 65 3d 22 63 6f 6e 66 69   den" name="confi
0110  67 22 20 76 61 6c 75 65 3d 22 65 74 68 65 72 65   g" value="ethere
0120  61 6c 22 3e 0a 09 09 20 20 3c 2f 64 69 76 3e 0a   al">...  </div>.
0130  09 20 20 20 20 20 20 20 20 3c 2f 74 64 3e 0a 09   .        </td>..
0140  09 3c 74 64 20 76 61 6c 69 67 6e 3d 22 62 6f 74   .<td valign="bot
0150  74 6f 6d 22 3e 0a 09 09 20 20 3c 69 6e 70 75 74   tom">...  <input
0160  20 74 79 70 65 3d 22 69 6d 61 67 65 22 20 63 6c    type="image" cl
0170  61 73 73 3d 22 67 6f 62 75 74 74 6f 6e 22 20 73   ass="gobutton" s
0180  72 63 3d 22 6d 6d 2f 69 6d 61 67 65 2f 67 6f 2d   rc="mm/image/go-
0190  62 75 74 74 6f 6e 2e 67 69 66 22 3e 0a 09 09 3c   button.gif">...<
01a0  2f 74 64 3e 0a 20 20 20 20 20 20 20 20 20 20 20   /td>.           
01b0  20 20 20 3c 2f 74 72 3e 0a 20 20 20 20 20 20 20      </tr>.       
01c0  20 20 20 20 20 20 20 3c 2f 66 6f 72 6d 3e 0a 3c          </form>.<
01d0  2f 74 61 62 6c 65 3e 0a 09 20 20 3c 2f 64 69 76   /table>..  </div
01e0  3e 0a 20 20 20 20 20 20 20 20 3c 2f 74 64 3e 0a   >.        </td>.
01f0  20 20 20 20 20 20 3c 2f 74 72 3e 0a 20 20 20 20         </tr>.    
0200  3c 2f 74 61 62 6c 65 3e 0a 20 20 20 20 3c 2f 64   </table>.    </d
0210  69 76 3e 0a 3c 64 69 76 20 63 6c 61 73 73 3d 22   iv>.<div class="
0220  73 69 74 65 62 61 72 22 3e 0a 3c 70 3e 0a 20 20   sitebar">.<p>.  
0230  3c 61 20 68 72 65 66 3d 22 2f 22 3e 48 6f 6d 65   <a href="/">Home
0240  3c 2f 61 3e 0a 20 20 3c 73 70 61 6e 20 63 6c 61   </a>.  <span cla
0250  73 73 3d 22 73 69 74 65 62 61 72 73 65 70 22 3e   ss="sitebarsep">
0260  7c 3c 2f 73 70 61 6e 3e 0a 20 20 3c 61 20 68 72   |</span>.  <a hr
0270  65 66 3d 22 69 6e 74 72 6f 64 75 63 74 69 6f 6e   ef="introduction
0280  2e 68 74 6d 6c 22 3e 49 6e 74 72 6f 64 75 63 74   .html">Introduct
0290  69 6f 6e 3c 2f 61 3e 0a 20 20 3c 73 70 61 6e 20   ion</a>.  <span 
02a0  63 6c 61 73 73 3d 22 73 69 74 65 62 61 72 73 65   class="sitebarse
02b0  70 22 3e 7c 3c 2f 73 70 61 6e 3e 0a 20 20 44 6f   p">|</span>.  Do
02c0  77 6e 6c 6f 61 64 0a 20 20 3c 73 70 61 6e 20 63   wnload.  <span c
02d0  6c 61 73 73 3d 22 73 69 74 65 62 61 72 73 65 70   lass="sitebarsep
02e0  22 3e 7c 3c 2f 73 70 61 6e 3e 0a 20 20 3c 61 20   ">|</span>.  <a 
02f0  68 72 65 66 3d 22 64 6f 63 73 2f 22 3e 44 6f 63   href="docs/">Doc
0300  75 6d 65 6e 74 61 74 69 6f 6e 3c 2f 61 3e 0a 20   umentation</a>. 
0310  20 3c 73 70 61 6e 20 63 6c 61 73 73 3d 22 73 69    <span class="si
0320  74 65 62 61 72 73 65 70 22 3e 7c 3c 2f 73 70 61   tebarsep">|</spa
0330  6e 3e 0a 20 20 3c 61 20 68 72 65 66 3d 22 6c 69   n>.  <a href="li
0340  73 74 73 2f 22 3e 4c 69 73 74 73 3c 2f 61 3e 0a   sts/">Lists</a>.
0350  20 20 3c 73 70 61 6e 20 63 6c 61 73 73 3d 22 73     <span class="s
0360  69 74 65 62 61 72 73 65 70 22 3e 7c 3c 2f 73 70   itebarsep">|</sp
0370  61 6e 3e 0a 20 20 3c 61 20 68 72 65 66 3d 22 66   an>.  <a href="f
0380  61 71 2e 68 74 6d 6c 22 3e 46 41 51 3c 2f 61 3e   aq.html">FAQ</a>
0390  0a 20 20 3c 73 70 61 6e 20 63 6c 61 73 73 3d 22   .  <span class="
03a0  73 69 74 65 62 61 72 73 65 70 22 3e 7c 3c 2f 73   sitebarsep">|</s
03b0  70 61 6e 3e 0a 20 20 3c 61 20 68 72 65 66 3d 22   pan>.  <a href="
03c0  64 65 76 65 6c 6f 70 6d 65 6e 74 2e 68 74 6d 6c   development.html
03d0  22 3e 44 65 76 65 6c 6f 70 6d 65 6e 74 3c 2f 61   ">Development</a
03e0  3e 0a 3c 2f 70 3e 0a 3c 2f 64 69 76 3e 0a 3c 64   >.</p>.</div>.<d
03f0  69 76 20 63 6c 61 73 73 3d 22 6e 61 76 62 61 72   iv class="navbar
0400  22 3e 0a 3c 70 3e 0a 20 20 3c 61 20 68 72 65 66   ">.<p>.  <a href
0410  3d 22 23 72 65 6c 65 61 73 65 73 22 3e 4f 66 66   ="#releases">Off
0420  69 63 69 61 6c 20 52 65 6c 65 61 73 65 73 3c 2f   icial Releases</
0430  61 3e 0a 20 20 3c 73 70 61 6e 20 63 6c 61 73 73   a>.  <span class
0440  3d 22 6e 61 76 62 61 72 73 65 70 22 3e 7c 3c 2f   ="navbarsep">|</
0450  73 70 61 6e 3e 0a 20 20 3c 61 20 68 72 65 66 3d   span>.  <a href=
0460  22 23 6f 74 68 65 72 70 6c 61 74 22 3e 4f 74 68   "#otherplat">Oth
0470  65 72 20 50 6c 61 74 66 6f 72 6d 73 3c 2f 61 3e   er Platforms</a>
0480  0a 20 20 3c 73 70 61 6e 20 63 6c 61 73 73 3d 22   .  <span class="
0490  6e 61 76 62 61 72 73 65 70 22 3e 7c 3c 2f 73 70   navbarsep">|</sp
04a0  61 6e 3e 0a 20 20 3c 61 20 68 72 65 66 3d 22 23   an>.  <a href="#
04b0  6f 74 68 65 72 64 6f 77 6e 22 3e 4f 74 68 65 72   otherdown">Other
04c0  20 44 6f 77 6e 6c 6f 61 64 73 3c 2f 61 3e 0a 20    Downloads</a>. 
04d0  20 3c 73 70 61 6e 20 63 6c 61 73 73 3d 22 6e 61    <span class="na
04e0  76 62 61 72 73 65 70 22 3e 7c 3c 2f 73 70 61 6e   vbarsep">|</span
04f0  3e 0a 20 20 3c 61 20 68 72 65 66 3d 22 23 6c 65   >.  <a href="#le
0500  67 61 6c 22 3e 4c 65 67 61 6c 20 4e 6f 74 69 63   gal">Legal Notic
0510  65 73 3c 2f 61 3e 0a 3c 2f 70 3e 0a 3c 2f 64 69   es</a>.</p>.</di
0520  76 3e 0a 3c 21 2d 2d 20 42 65 67 69 6e 20 41 64   v>.<!-- Begin Ad
0530  20 34 36 38 78 36 30 20 2d 2d 3e 0a 3c 64 69 76    468x60 -->.<div
0540  20 63 6c 61 73 73 3d 22 61 64 62 6c 6f 63 6b 22    class="adblock"
0550  3e 0a 3c 73 63 72 69 70 74 20 74 79 70 65 3d 22   >.<script type="
0560  74 65 78 74 2f 6a 61 76 61 73 63 72 69 70 74 22   text/javascript"
0570  3e 3c 21 2d 2d 0a 67 6f 6f 67 6c 65 5f 61 64 5f   ><!--.google_ad_
0580  63 6c 69 65 6e 74 20 3d 20 22 70 75 62 2d 32 33   client = "pub-23
0590  30 39 31 39 31 39 34 38 36 37                     0919194867

Frame 1: 533 bytes on wire (4264 bits), 533 bytes captured (4264 bits)
    WTAP_ENCAP: 1
    Arrival Time: May 13, 2004 06:17:08.222534000 EDT
    [Time shift for this packet: 0.000000000 seconds]
    Epoch Time: 1084443428.222534000 seconds
    [Time delta from previous captured frame: 0.000000000 seconds]
    [Time delta from previous displayed frame: 0.000000000 seconds]
    [Time since reference or first frame: 0.000000000 seconds]
    Frame Number: 1
    Frame Length: 533 bytes (4264 bits)
    Capture Length: 533 bytes (4264 bits)
    [Frame is marked: False]
    [Frame is ignored: False]
    [Protocols in frame: eth:ip:tcp:http]
Ethernet II, Src: Xerox_00:00:00 (00:00:01:00:00:00), Dst: fe:ff:20:00:01:00 (fe:ff:20:00:01:00)
    Destination: fe:ff:20:00:01:00 (fe:ff:20:00:01:00)
        Address: fe:ff:20:00:01:00 (fe:ff:20:00:01:00)
        .... ..1. .... .... .... .... = LG bit: Locally administered address (this is NOT the factory default)
        .... ...0 .... .... .... .... = IG bit: Individual address (unicast)
    Source: Xerox_00:00:00 (00:00:01:00:00:00)
        Address: Xerox_00:00:00 (00:00:01:00:00:00)
        .... ..0. .... .... .... .... = LG bit: Globally unique address (factory default)
        .... ...0 .... .... .... .... = IG bit: Individual address (unicast)
    Type: IP (0x0800)
Internet Protocol Version 4, Src: 145.254.160.237 (145.254.160.237), Dst: 65.208.228.223 (65.208.228.223)
    Version: 4
    Header length: 20 bytes
    Differentiated Services Field: 0x00 (DSCP 0x00: Default; ECN: 0x00: Not-ECT (Not ECN-Capable Transport))
        0000 00.. = Differentiated Services Codepoint: Default (0x00)
        .... ..00 = Explicit Congestion Notification: Not-ECT (Not ECN-Capable Transport) (0x00)
    Total Length: 519
    Identification: 0x0f45 (3909)
    Flags: 0x02 (Don't Fragment)
        0... .... = Reserved bit: Not set
        .1.. .... = Don't fragment: Set
        ..0. .... = More fragments: Not set
    Fragment offset: 0
    Time to live: 128
    Protocol: TCP (6)
    Header checksum: 0x9010 [correct]
        [Good: True]
        [Bad: False]
    Source: 145.254.160.237 (145.254.160.237)
    Destination: 65.208.228.223 (65.208.228.223)
    [Source GeoIP: Unknown]
    [Destination GeoIP: Unknown]
Transmission Control Protocol, Src Port: tip2 (3372), Dst Port: http (80), Seq: 951057940, Ack: 290218380, Len: 479
    Source port: tip2 (3372)
    Destination port: http (80)
    [Stream index: 0]
    Sequence number: 951057940
    [Next sequence number: 951058419]
    Acknowledgment number: 290218380
    Header length: 20 bytes
    Flags: 0x018 (PSH, ACK)
        000. .... .... = Reserved: Not set
        ...0 .... .... = Nonce: Not set
        .... 0... .... = Congestion Window Reduced (CWR): Not set
        .... .0.. .... = ECN-Echo: Not set
        .... ..0. .... = Urgent: Not set
        .... ...1 .... = Acknowledgment: Set
        .... .... 1... = Push: Set
        .... .... .0.. = Reset: Not set
        .... .... ..0. = Syn: Not set
        .... .... ...0 = Fin: Not set
    Window size value: 9660
    [Calculated window size: 9660]
    [Window size scaling factor: -1 (unknown)]
    Checksum: 0xa958 [validation disabled]
        [Good Checksum: False]
        [Bad Checksum: False]
    [SEQ/ACK analysis]
        [Bytes in flight: 479]
Hypertext Transfer Protocol
    GET /download.html HTTP/1.1\r\n
        [Expert Info (Chat/Sequence): GET /download.html HTTP/1.1\r\n]
            [Message: GET /download.html HTTP/1.1\r\n]
            [Severity level: Chat]
            [Group: Sequence]
        Request Method: GET
        Request URI: /download.html
        Request Version: HTTP/1.1
    Host: www.ethereal.com\r\n
    User-Agent: Mozilla/5.0 (Windows; U; Windows NT 5.1; en-US; rv:1.6) Gecko/20040113\r\n
    Accept: text/xml,application/xml,application/xhtml+xml,text/html;q=0.9,text/plain;q=0.8,image/png,image/jpeg,image/gif;q=0.2,*/*;q=0.1\r\n
    Accept-Language: en-us,en;q=0.5\r\n
    Accept-Encoding: gzip,deflate\r\n
    Accept-Charset: ISO-8859-1,utf-8;q=0.7,*;q=0.7\r\n
    Keep-Alive: 300\r\n
    Connection: keep-alive\r\n
